{
  "schema_version": "1",
  "dataset_id": "GENERATED_BY_PREPARE_DATA_DO_NOT_FILL_MANUALLY",
  "variant": "HI-Small",
  "synthetic": true,
  "source_url": "https://www.kaggle.com/datasets/ealtman2019/ibm-transactions-for-anti-money-laundering-aml",
  "acquired_at": "REQUIRED_ACTUAL_ACQUISITION_TIME_WITH_OFFSET",
  "source_terms": "REQUIRED_TERMS_OF_THE_EXACT_COPY",
  "timezone_policy": "REQUIRED_EXPLICIT_IANA_TIMEZONE",
  "timestamp_precision": "minute",
  "normalization_version": "1",
  "observation_intervals": [],
  "known_gaps": [],
  "source_files": [
    {
      "relative_path": "HI-Small_Trans.csv",
      "sha256": "GENERATED_FROM_ACTUAL_FILE",
      "byte_count": 0,
      "header": [
        "Timestamp",
        "From Bank",
        "Account",
        "To Bank",
        "Account",
        "Amount Received",
        "Receiving Currency",
        "Amount Paid",
        "Payment Currency",
        "Payment Format",
        "Is Laundering"
      ]
    }
  ]
}
